{
 "template_id": "orange_warm",
 "language": "zh-CN",
 "header": {
  "name": "示例姓名",
  "phone": "138-0000-0000",
  "email": "your.name@example.com",
  "location": "城市",
  "website": "github.com/yourname"
 },
 "modules": [
  {
   "module_id": "education",
   "title": "教育背景",
   "items": [
    {
     "school": "示例大学",
     "badges": [
      "985",
      "211"
     ],
     "degree": "硕士",
     "major": "计算机科学与技术",
     "college": "计算机学院",
     "study_type": "全日制",
     "time": "2023.09 - 2026.07",
     "location": "城市",
     "details": [
      "研究方向：示例研究方向，如机器学习、自然语言处理。"
     ]
    }
   ]
  },
  {
   "module_id": "experience",
   "title": "实习/工作经历",
   "items": [
    {
     "organization": "示例科技公司",
     "role": "示例岗位（如算法实习生）",
     "time": "2025.04 - 2025.10",
     "project": "示例项目名称",
     "bullets": [
      {
       "label": "背景",
       "text": "用一句话说明项目背景与要解决的核心问题。"
      },
      {
       "label": "方案",
       "text": "说明采用了哪些技术、方法或架构来解决问题。"
      },
      {
       "label": "成果",
       "text": "用可量化的指标说明最终取得的效果。"
      }
     ]
    }
   ]
  },
  {
   "module_id": "projects",
   "title": "项目经历",
   "items": [
    {
     "name": "示例项目",
     "role": "个人项目",
     "time": "2025.01 - 2025.03",
     "bullets": [
      "用一到两句话描述项目目标与你承担的角色。",
      "说明关键技术实现与你的具体贡献。"
     ]
    }
   ]
  },
  {
   "module_id": "awards",
   "title": "荣誉奖项/证书",
   "items": [
    {
     "name": "示例竞赛奖项一",
     "time": "2025.03"
    },
    {
     "name": "示例荣誉证书二",
     "time": "2024.11"
    }
   ]
  }
 ],
 "quality_constraints": {
  "page_limit": 1,
  "max_experience_bullets": 3,
  "max_project_bullets": 3,
  "max_awards": 5
 }
}
